{
  "submission_data": {
    "project_name": "AI Image Generator Pro",
    "team_name": "The Neural Networks",
    "category": "AI/Agents",
    "description": "An advanced AI-powered image generation tool that creates stunning visuals from text prompts using the latest diffusion models.",
    "discord_handle": "neuralnetworks#1234",
    "twitter_handle": "@neuralnetworks",
    "github_url": "https://github.com/neuralnetworks/ai-image-gen-pro",
    "demo_video_url": "https://youtube.com/watch?v=demo123",
    "live_demo_url": "https://ai-image-gen-pro.com",
    "project_image": "/api/uploads/69febe84-a5f8-4c6f-99e1-b5bc91015e9f.png",
    "tech_stack": "Python, PyTorch, Diffusers, FastAPI, React, TailwindCSS",
    "how_it_works": "Our system uses a fine-tuned stable diffusion model combined with custom LoRA adapters to generate high-quality images from text descriptions. The backend is built with FastAPI and the frontend uses React with real-time WebSocket updates.",
    "problem_solved": "Current AI image generators are expensive, slow, or produce low-quality results. Our solution provides fast, high-quality image generation at affordable prices with an intuitive interface.",
    "favorite_part": "The real-time generation preview that shows the image being created step-by-step, giving users insight into the AI's creative process.",
    "solana_address": "9WzDXwBbmkg8ZTbNMqUxvQRAyrZzDsGYdLVL9zYtAWWM",
    "submission_id": "ai_image_generator_pro-1751430410",
    "status": "submitted",
    "created_at": "2025-07-02T00:26:50.985902",
    "updated_at": "2025-07-02T00:26:50.985902"
  },
  "timestamp": "2025-07-02T00:26:50.985902",
  "request_info": {
    "client_ip": "127.0.0.1",
    "user_agent": "python-requests/2.32.3",
    "content_type": "application/json"
  },
  "metadata": {
    "submission_id": "ai_image_generator_pro-1751430410",
    "table": "hackathon_submissions_v2",
    "backup_version": "1.0"
  },
  "error": {
    "message": "(sqlite3.OperationalError) table hackathon_submissions_v2 has no column named project_image\n[SQL: INSERT INTO hackathon_submissions_v2 (project_name, team_name, category, description, discord_handle, twitter_handle, github_url, demo_video_url, live_demo_url, project_image, tech_stack, how_it_works, problem_solved, favorite_part, solana_address, submission_id, status, created_at, updated_at) VALUES (?, ?, ?, ?, ?, ?, ?, ?, ?, ?, ?, ?, ?, ?, ?, ?, ?, ?, ?)]\n[parameters: ('AI Image Generator Pro', 'The Neural Networks', 'AI/Agents', 'An advanced AI-powered image generation tool that creates stunning visuals from text prompts using the latest diffusion models.', 'neuralnetworks#1234', '@neuralnetworks', 'https://github.com/neuralnetworks/ai-image-gen-pro', 'https://youtube.com/watch?v=demo123', 'https://ai-image-gen-pro.com', '/api/uploads/69febe84-a5f8-4c6f-99e1-b5bc91015e9f.png', 'Python, PyTorch, Diffusers, FastAPI, React, TailwindCSS', 'Our system uses a fine-tuned stable diffusion model combined with custom LoRA adapters to generate high-quality images from text descriptions. The backend is built with FastAPI and the frontend uses React with real-time WebSocket updates.', 'Current AI image generators are expensive, slow, or produce low-quality results. Our solution provides fast, high-quality image generation at affordable prices with an intuitive interface.', \"The real-time generation preview that shows the image being created step-by-step, giving users insight into the AI's creative process.\", '9WzDXwBbmkg8ZTbNMqUxvQRAyrZzDsGYdLVL9zYtAWWM', 'ai_image_generator_pro-1751430410', 'submitted', '2025-07-02T00:26:50.985902', '2025-07-02T00:26:50.985902')]\n(Background on this error at: https://sqlalche.me/e/20/e3q8)",
    "type": "OperationalError",
    "timestamp": "2025-07-02T00:26:50.986519"
  }
}